	LING. ISSUE	QUESTION	SOURCE	NRC PBMT	NRC PBMT2	NRC's NMT	Google's NMT (March 2017)	REFERENCE (Pierre's translation)
								
S1a	Morpho-Syn 1: S-V agreement, across distractors	Is subject-verb agrement correct? (Possible interference distractors between the subject's head and the verb).	The repeated calls from his mother [should] have alerted us.	Les appels répétés de sa mère [aurait] dû nous a alertés.	Les appels répétés de sa mère [aurait] dû nous a alertés.	Les appels répétés de sa mère [devraient] nous avoir alertés.	Les appels répétés de sa mère [auraient] dû nous alerter.	Les appels répétés de sa mère [auraient] dû nous alerter.
S1b			The sudden noise in the upper rooms [should] have alerted us.	Le bruit soudain dans les chambres supérieures [auraient] dû nous a alertés.	Le bruit soudain dans les chambres supérieures [auraient] dû nous a alertés.	Le bruit soudain dans les chambres supérieures devrait nous avoir alerté.	Le bruit soudain dans les chambres supérieures [devrait] nous avoir alerté.	Le bruit soudain dans les chambres supérieures [aurait] dû nous alerter.
S1a			Their repeated failures to report the problem [should] have alerted us.	Leurs échecs répétés de signaler le problème [aurait] dû nous a alertés.	Leurs échecs répétés à signaler le problème [aurait] dû nous a alertés.	Leurs échecs répétés pour signaler le problème [devraient] nous avoir alertés.	Leur échec répété à signaler le problème [aurait] dû nous alerter.	Leurs échecs répétés à signaler le problème [auraient] dû nous alerter.
								
S2a	Morpho-Syn 2: S-V agreement, through control verbs	Does the flagged adjective agree correctly with its subject? (Subject-control versus object-control verbs).	She asked her brother not to be [arrogant].	Elle a demandé à son frère de ne pas être [arrogant].	Elle a demandé à son frère de ne pas être [arrogants].	Elle a demandé à son frère de ne pas être [arrogant].	Elle a demandé à son frère de ne pas être [arrogant].	Elle a demandé à son frère de ne pas se montrer [arrogant].
S2b			She promised her brother not to be [arrogant].	Elle a promis son frère à ne pas être [arrogant].	Elle a promis son frère de ne pas être [arrogants].	Elle a promis à son frère de ne pas être [arrogant ].	Elle a promis à son frère de ne pas être [arrogant].	Elle a promis à son frère de ne pas être [arrogante].
S2c			She promised her doctor to remain [active] after retiring.	Elle a promis son médecin pour demeurer [actif] après sa retraite.	Elle a promis son médecin de demeurer [active] après sa retraite.	Elle a promis à son médecin de rester [actif] après sa retraite.	Elle a promis à son médecin de rester [actif] après sa retraite.	Elle a promis à son médecin de demeurer [active] après s'être retirée.
S2d			My mother promised my father to be more [prudent] on the road.	Ma mère , mon père a promis d'être plus [prudent] sur la route.	Ma mère , mon père a promis d'être plus [prudent] sur la route.	Ma mère a promis à mon père d'être plus [prudent] sur la route.	Ma mère a promis à mon père d'être plus [prudent] sur la route.	Ma mère a promis à mon père d'être plus [prudente] sur la route.
								
S3a	Morpho-Syn 3: S-V agreement, coordinated targets	Do the marked verbs/adjective agree correctly with their subject? (Agreement distribution over coordinated predicates)	The woman was very [tall] and extremely [strong].	La femme était très [gentil] et extrêmement [forte].	La femme était très [gentil] et très [fort].	La femme était très [haute] et extrêmement [forte].	La femme était très [grande] et extrêmement [forte].	La femme était très [grande] et extrêmement [forte].
S3b			Their politicians were more [ignorant] than [stupid].	Les politiciens étaient plus [ignorants] que [stupide].	Les politiciens étaient plus [ignorants] que [stupide].	Leurs politiciens étaient plus [ignorants] que [stupides].	Leurs politiciens étaient plus [ignorants] que [stupides].	Leurs politiciens étaient plus [ignorants] que [stupides].
S3c			We [shouted] an insult and [left] abruptly.	Nous [avons] crié une insulte et [a] quitté abruptement.	Nous [avons] crié une insulte et [a] laissé brutalement.	Nous [avons] crié une insulte et [nous] [avons] laissé brusquement.	Nous [avons] crié une insulte et nous [sommes] partis brusquement.	Nous [avons] lancé une insulte et nous [sommes] partis brusquement.
								
S4a1	Morpho-Syn 4: S-V agreement, feature calculus on coordinated source 	Do the marked verbs/adjective agree correctly with their subject? (Masculine singular ET masculine singular yields masculine plural).	The cat and the dog [should] be [watched].	Le chat et le chien [doit ]être [regardée].	Le chat et le chien [doit ]être [regardée].	Le chat et le chien [doivent] être [regardés].	Le chat et le chien [doivent] être [surveillés].	Le chat et le chien [devraient] être [surveillés].
S4a2 			My father and my brother [will] be [happy] tomorrow.	Mon père et mon frère [sera] [heureux] de demain.	Mon père et mon frère se [fera] un plaisir de demain.	Mon père et mon frère [seront] [heureux] demain.	Mon père et mon frère [seront] [heureux] demain.	Mon père et mon frère [seront] [heureux] demain.
S4a3			My book and my pencil [could] be [stolen].	Mon livre et mon crayon [pourrait] être [volé].	Mon livre et mon crayon [pourrait] être [volé].	Mon livre et mon crayon [pourraient] être [volés].	Mon livre et mon crayon [pourraient] être [volés].	Mon livre et mon crayon [pourraient] être [volés].
S4b1		Do the marked verbs/adjective agree correctly with their subject? (Feminine singular ET feminine singular yields feminine plural).	The cow and the hen [must] be [fed].	La vache et de la poule [doivent] être [nourris].	La vache et de la poule [doivent] être [nourris].	la vache et la poule [doivent] être [alimentées].	La vache et la poule [doivent] être [nourries].	La vache et la poule [doivent] être [nourries].
S4b2			My mother and my sister [will be happy] tomorrow.	Ma mère et ma sœur [sera] [heureux] de demain.	Ma mère et ma soeur se [fera] un plaisir de demain.	Ma mère et ma sœur [seront heureuses] demain.	Ma mère et ma sœur [seront heureuses] demain.	Ma mère et ma sœur [seront heureuses] demain.
S4b3			My shoes and my socks [will] be [found].	Mes chaussures et mes chaussettes [sera] [trouvé] .	Mes chaussures et mes chaussettes [sera] [trouvé] .	Mes chaussures et mes chaussettes [seront] [trouvées].	Mes chaussures et mes chaussettes [seront] [trouvées].	Mes chaussures et mes chaussettes [seront] [retrouvées].
S4c1		Do the marked verbs/adjective agree correctly with their subject? (Masculine singular ET feminine singular yields masculine plural.)	The dog and the cow [are] [nervous].	Le chien et la vache [sont] [nerveux].	Le chien et la vache [sont] [nerveux].	Le chien et la vache [sont] [nerveux].	Le chien et la vache [sont] [nerveux].	Le chien et la vache [sont] [nerveux].
S4c2			My father and my mother  will  be happy tomorrow.	Mon père et ma mère se [fera] un plaisir de demain.	Mon père et ma mère se [fera] un plaisir de demain.	Mon père et ma mère [seront] [heureux] demain.	Mon père et ma mère [seront] [heureux] demain.	Mon père et ma mère [seront] [heureux] demain.
S4c3			My refrigerator and my kitchen table [were] [stolen].	Mon réfrigérateur et ma table de cuisine [ont] été [volés].	Mon réfrigérateur et ma table de cuisine [ont] été [volés].	Mon réfrigérateur et ma table de cuisine [ont] été [volés].	Mon réfrigérateur et ma table de cuisine [ont] été [volés].	Mon réfrigérateur et ma table de cuisine [ont] été [volés].
S4d1		Do the marked verbs/adjective agree correctly with their subject? (Smallest coordinated grammatical person wins.)	Paul and I [could] easily be [convinced] to join you.	Paul et je [pourrais] facilement être [persuadée] de se joindre à vous.	Paul et je [pourrais] facilement être [convaincus] de se joindre à vous.	Paul et moi [avons] facilement pu être convaincus de vous rejoindre.	Paul et moi [pourrait] facilement être convaincu de vous rejoindre.	Paul et moi [pourrions] facilement être [convaincus] de se joindre à vous.
S4d2			You and he [could] be [surprised] by her findings.	Vous et qu'il [pouvait] être [surpris] par ses conclusions.	Vous et qu'il [pouvait] être [surpris] par ses conclusions.	Vous et lui [pourriez] être [surpris] par ses conclusions.	Vous et lui [pourrait] être [surpris] par ses découvertes.	Vous et lui [pourriez]  être [surpris] par ses découvertes.
S4d3			We and they [are] on different courses.	Nous et ils [sont] en cours de différents.	Nous et ils [sont] en cours différents.	Nous et nous [sommes] sur des parcours différents.	Nous et ils [sont] sur des parcours différents.	Nous et eux [sommes] sur des trajectoires différentes.
								
S5a	Morpho-Syn 5: S-V agreement, past participles	Are the agreement marks of the flagged participles the correct ones? (Past participle placed after auxiliary AVOIR agrees with verb object iff object precedes auxiliary. Otherwise participle is in masculine singular form).	The woman who [saw] a mouse in the corridor is charming.	La femme qui a [vu] une souris dans le couloir est charmante.	La femme qui a [vu] une souris dans le couloir est charmante.	La femme qui a [vu] une souris dans le couloir est charmante.	La femme qui a [vu] une souris dans le couloir est charmante.	La femme qui a [vu] une souris dans le couloir est charmante.
S5b			The woman that your brother [saw] in the corridor is charming.	La femme que ton frère a [vu] dans le couloir est charmante.	La femme que ton frère a [vu] dans le couloir est charmante.	La femme que votre frère a [vu] dans le corridor est charmante.	La femme que votre frère a [vue] dans le couloir est charmante.	La femme que votre frère a [vue] dans le couloir est charmante.
S5c			The house that John has [visited] is crumbling.	La maison que John a [visité] est en train de s'écrouler.	La maison que John a [visité] s'effritent.	La maison que John a [visitée] est en train de s' effondrer.	La maison que John a [visité] est en ruine.	La maison que John a [visitée] tombe en ruines.
S5d			John sold the car that he had [won] in a lottery.	John a vendu la voiture qu'il avait [gagné] à la loterie.	John a vendu la voiture qu'il avait [gagné] à la loterie.	John a vendu la voiture qu' il avait [gagnée] dans une loterie.	John a vendu la voiture qu' il avait [gagnée] dans une loterie.	John a vendu la voiture qu' il avait [gagnée] dans une loterie.
								
S6a	Morpho-Syn 6: Subjunctive mood	Ia the flagged verb in the correct mood? (Certain triggering verbs, adjectives or subordinate conjunctions, induce the subjunctive mood in the subordinate clause that they govern). 	He will come provided that you [come] too.	Il viendra à condition que vous [venez] aussi.	Il viendra à condition que vous [venez] de trop.	Il viendra lui aussi que vous le [faites].	Il viendra à condition que vous [venez] aussi.	Il viendra à condition que vous [veniez] aussi.
S6b			It is unfortunate that he is not [coming] either.	Il est regrettable qu'il n'est pas non plus à [venir].	Il est regrettable qu'il n'est pas non plus à [venir].	Il est regrettable qu' il ne [soit] pas non plus.	Il est malheureux qu'il ne [vienne] pas non plus.	Il est malheureux qu'il ne [vienne] pas non plus.
S6c			I requested that families not [be] separated.	J'ai demandé que les familles ne [soient] pas séparées.	J'ai demandé que les familles ne [soient] pas séparées.	J'ai demandé que les familles ne [soient] pas séparées.	J'ai demandé que les familles ne [soient] pas séparées.	J'ai demandé que les familles ne [soient] pas séparées.
								
S7a	Lex-Syn 1: Argument switch	Are the experiencer and the object of the "missing" situation correctly preseved in the French translation? (Argument switch).	[Mary] sorely misses [Jim].	[Marie] manque cruellement de [Jim].	[Marie] manque cruellement de [Jim].	[Mary] a lamentablement manqué [de Jim ].	[Mary] manque cruellement à [Jim].	[Jim] manque cruellement [à Mary].
S7b			[My sister] is really missing [New York.]	[Ma sœur] est vraiment absent de [New York].	[Ma sœur] n'est vraiment pas [New York].	[Ma sœur] est vraiment manquante [à New York].	[Ma sœur] manque vraiment [New York].	[New York] manque beaucoup [à ma sœur].
S7c			What [he] misses most is [his dog].	Ce qu'[il] manque le plus, c'est [son chien].	Ce qu'[il] manque le plus, c'est [son chien].	Ce qu'[il] manque le plus, c'est [son chien].	Ce qu'il manque le plus, c'est son chien.	Ce qui [lui] manque le plus, c'est [son chien].
								
S8a	Lex-Syn 2: Double-object verbs	Are "gift" and "recipient" arguments correctly rendered in French? (English double-object constructions)	John gave [his wonderful wife] a nice present.	John a donné [sa merveilleuse femme] un beau cadeau.	John a donné [sa merveilleuse femme] un beau cadeau.	John a donné [à sa merveilleuse femme] un beau cadeau.	John a donné [à son épouse] merveilleuse un présent gentil.	John a donné un beau présent [à sa merveilleuse épouse]. 
S8b			John told [the kids] a nice story.	John a dit [aux enfants] une belle histoire.	John a raconté [aux enfants] une belle histoire.	John a dit [aux enfants] une belle histoire.	John a raconté [aux enfants] une belle histoire.	John a raconté une belle histoire [aux enfants].
S8c			John sent [his mother] a nice postcard.	John a envoyé [sa mère] une carte postale de nice.	John a envoyé [sa mère] une belle carte postale.	John a envoyé [sa mère] une carte postale de nice.	John envoya [à sa mère] une belle carte postale.	John a envoyé une belle carte postale [à sa mère].
								
S9a	Lex-Syn 3: Fail to	Is the meaning of "fail to" correctly rendered in the French translation? 	John [failed to] see the relevance of this point.	John a [omis de] voir la pertinence de ce point.	John [n'a pas su] voir la pertinence de ce point.	John [n'a pas] vu la pertinence de ce point.	John a [omis de] voir la pertinence de ce point.	John [n'a pas] vu la pertinence de ce point.
S9b			He failed to respond.	Il [n'a pas réussi] à répondre.	Il [n'a pas répondu].	Il [n'a pas répondu].	Il [n'a pas répondu].	Il [n'a pas répondu].
S9c			Those who fail to comply with this requirement will  be penalized.	Ceux qui [ne] se conforment [pas] à cette obligation seront pénalisés.	Ceux qui [ne] se conforment [pas] à cette exigence sera pénalisé.	Ceux qui [ne] se conforment [pas] à cette obligation seront pénalisés.	Ceux qui [ne] respectent [pas] cette exigence seront pénalisés.	Ceux qui [ne] se conforment [pas] à cette exigence seront pénalisés.
								
S10a	Lex-Syn 4: Manner-of-movement verbs	Is the movement action expressed in the English source correctly rendered in French? (Manner-of-movement verbs with path argument need to be rephrased in French).	John would like to [swim across] the river.	John aimerait [nager dans] la rivière.	John voudrait [se baigner dan]s la rivière.	John aimerait [nager à travers] la rivière.	John aimerait [nager à travers] la rivière.	John aimerait [traverser] la rivière [à la nage].
S10b			They [ran into] the room.	Ils ont [couru dans] la chambre.	Ils ont [couru dans] la pièce.	Ils ont [couru dans] la pièce.	Ils [coururent dans] la pièce.	Ils [sont entrés] dans la chambre [à la course].
S10c			The man [ran out of] the park.	L'homme a [manqué du] parc.	L'homme a [manqué du] parc.	L' homme [s' enfuit du] parc.	L'homme [sortit du] parc.	L'homme [est sorti du] parc [en courant].
S10d		Hard example featuring spontaneous noun-to-verb derivation ("nonce verb").	John [guitared his way] to San Francisco.	John [guitared] [son chemin à] San Francisco.	John [guitared sa voie à] San Francisco.	John guitared sa route à San Francisco.	John a [guité son chemin] à San Francisco.	John [s'est rendu] jusqu'à San Francisco [en jouant de la guitare].
								
S11a	Lex-Syn 5: Overlapping subcat frames	Is the French verb for "know" correctly chosen? (Choice between "Savoir"/"connaître"  depends on syntactic nature of its object)	Paul [knows] that this is a fact.	Paul [sait que] c'est un fait.	Paul [sait que] c'est un fait.	Paul [sait que] c'est un fait.	Paul [sait que] c'est un fait.	Paul [sait que] c'est un fait.
S11b			Paul [knows] this story.	Paul [connaît] cette histoire.	Paul [connaît] cette histoire.	Paul [connaît] cette histoire.	Paul [connaît] cette histoire.	Paul [connaît] cette histoire.
S11c			Paul [knows] this story is hard to believe.	Paul [connaît] cette histoire est difficile à croire.	Paul [connaît] cette histoire est difficile à croire.	Paul [sait que] cette histoire est difficile à croire.	Paul [sait que] cette histoire est difficile à croire.	Paul [sait que] cette histoire est difficile à croire.
S11d			He [knows] my sister will not take it.	Il [sait que] ma soeur ne prendra pas.	Il [sait que] ma soeur ne prendra pas.	Il [sait que] ma soeur ne le prendra pas.	Il [sait que] ma soeur ne le prendra pas.	Il [sait que] ma soeur ne le prendra pas.
S11e			My sister [knows] your son is reliable.	Ma soeur [connaît] votre fils est fiable.	Ma soeur [connaît] votre fils est fiable.	Ma sœur [sait que] votre fils est fiable.	Ma sœur [sait que] votre fils est fiable.	Ma sœur [sait que] votre fils est fiable.
								
S12a	Lex-Syn 6: NP to VP	Is the English "NP to VP" complement correctly rendred in the French translation? (Sometimes one needs to translate this structure as a finite clause).	John believes [Bill to be dishonest].	John estime [que le projet de loi soit malhonnête].	John estime [que le projet de loi d'être malhonnête].	John croit [que le projet de loi est malhonnête].	John croit [que Bill est malhonnête].	John croit [que Bill est malhonnête].
S12b			He liked [his father to tell him stories].	Il aimait [son père pour lui raconter des histoires].	Il aimait [son père pour lui raconter des histoires].	Il aimait [son père pour lui raconter des histoires].	Il aimait [son père à lui raconter des histoires].	Il aimait [que son père lui raconte des histoires].
S12c			She wanted [her mother to let her go].	Elle voulait [que sa mère de lui laisser aller].	Elle voulait [que sa mère de la laisser aller].	Elle voulait [que sa mère la laisse faire].	Elle voulait [que sa mère la laisse partir].	Elle voulait [que sa mère la laisse partir].
								
S13a	Lex-Syn 7: Factitives	Is the English verb correctly rendered in the French translation? (Agentive use of some French verbs require embedding under "faire").	John [cooked] a big chicken.	John [cuit] un gros poulet.	Un gros poulet [cuit] john.	John [cuit] un gros poulet.	John a [fait cuire] un gros poulet.	John a [fait cuire] un gros poulet.
S13b			John [melted] a lot of ice.	John [fondu] a lot of ice.	John a [fondu] beaucoup de glace.	John a [fondu] beaucoup de glace.	John a [fondu] beaucoup de glace.	John a [fait fondre] beaucoup de glace.
S13c			She likes to [grow] flowers.	Elle aime à se développer des fleurs.	Elle aime à cultiver des fleurs.	Elle aime à cultiver des fleurs.	Elle aime [faire pousser] des fleurs.	Elle aime [faire pousser] des fleurs.
								
S14a	Lex-Syn 8: Noun Compounds	Is the English nominal compound rendered with the right preposition in the French translation?	Use the meat knife.	Utilisez le couteau [de] viande.	Utilisez le couteau [de] viande.	Utilisez le couteau [à] viande.	Utilisez le couteau [à] viande.	Utilisez le couteau [à] viande.
S14b			Use the butter knife.	Utilisez le couteau [à] beurre.	Utilisez le couteau [à] beurre.	Utilisez le couteau [au] beurre.	Utilisez le couteau [à] beurre.	Utilisez le couteau [à] beurre.
S14c			Use the steak knife.	Utilisez le steak [] couteau.	Utilisez le couteau [à] viande.	Utilisez le couteau [à] steak.	Utilisez le couteau [de] steak.	Utilisez le couteau [à] steak.
S14d			Clean the water filter.	Nettoyez le filtre [à] eau.	Nettoyez le filtre [à] eau.	Nettoyez le filtre [à] eau.	Nettoyez le filtre [à] eau.	Nettoyez le filtre [à] eau.
S14e			Clean the juice filter.	Nettoyez le filtre [de] jus.	Nettoyez le filtre [de] jus.	Nettoyez le filtre [de] jus.	Nettoyez le filtre [à] jus.	Nettoyez le filtre [à] jus.
S14f			Clean the tea filter.	Nettoyez le filtre [à] thé.	Nettoyez le filtre [à] thé.	Nettoyez le filtre [de] thé.	Nettoyez le filtre [à] thé.	Nettoyez le filtre [à] thé.
S14g			Clean the cloth filter.	Nettoyez le filtre [en] tissu.	Nettoyez le filtre [en] tissu.	Nettoyez le filtre [en] tissu.	Nettoyez le filtre [en] tissu.	Nettoyez le filtre [en] tissu.
S14h			Clean the metal filter. 	Nettoyez le filtre [en] métal.	Nettoyez le filtre [en] métal.	Nettoyez le filtre [en] métal.	Nettoyez le filtre [métallique].	Nettoyez le filtre [en] métal.
S14i			Clean the paper filter.	Nettoyez le filtre [en] papier.	Nettoyer le filtre [à] papier.	Nettoyez le filtre [en] papier.	Nettoyez le filtre [à] papier.	Nettoyez le filtre [en] papier.
								
S15a	Lex-Syn 9: Common idioms	Is the English idiomatic expression correctly rendered by an equivalent French idiomatic expression?	Stop [beating around the bush].	Cesser de [battre la campagne].	Cesser de [battre la campagne].	Arrêtez de [battre autour de la brousse]. 	Arrêter de [tourner autour du pot].	Cessez de [tourner autour du pot].
S15b			You are [putting the cart before the horse].	Vous pouvez [mettre la charrue avant les bœufs].	Vous êtes en train de [mettre la charrue avant les bœufs].	Vous [mettez la charrue avant le cheval].	Vous [mettez le chariot devant le cheval].	Vous [mettez la charrue devant les bœufs].
S15c			His comment proved to be [the straw that broke the camel's back].	Son commentaire s'est révélé être [la goutte d'eau qui fait déborder le vase].	Son commentaire s'est avéré être [la goutte d'eau qui fait déborder le vase].	Son commentaire s'est avéré être [la paille qui a brisé le dos du chameau].	Son commentaire s'est avéré être [la paille qui a cassé le dos du chameau].	Son commentaire s'est avéré être [la goutte d'eau qui a fait déborder le vase].
S15d			His argument really [hit the nail on the head].	Son argument a vraiment [mis le doigt dessus].	Son argument a vraiment mis le doigt dessus.	Son argument a vraiment [frappé le clou sur la tête].	Son argument a vraiment [frappé le clou sur la tête].	Son argument a vraiment [fait mouche].
S15e			It's [no use crying over spilt milk].	[Ce n'est pas de pleurer sur le lait répandu].	[Ce n'est pas de pleurer sur le lait répandu].	[Il ne sert à rien de pleurer sur le lait haché].	[Ce qui est fait est fait].	[Ce qui est fait est fait].
S15f			It is [no use crying over spilt milk].	[Il ne suffit pas de pleurer sur le lait répandu].	[Il ne suffit pas de pleurer sur le lait répandu].	[Il ne sert à rien de pleurer sur le lait écrémé.	[Il est inutile de pleurer sur le lait répandu].	[Ce qui est fait est fait].
								
S16a	Lex-Syn 10: Syntactically flexible idioms	Is the English idimatic expression correctly rendered in French in spite of the fact that it appears in a less basic syntactic guise?	The cart has been put before the horse.	On [met la charrue devant le cheval].	On met [la charrue avant les bœufs].	Le [chariot a été mis avant le cheval].	Le [chariot a été mis devant le cheval].	La [charrue a été mise devant les bœufs].
S16b			With this argument, [the nail has been hit on the head].	Avec cette argument, [l'ongle a été frappée à la tête].	Avec cette argument, [l'ongle a été frappée à la tête].	Avec cet argument , [l'ongle a été touché à la tête].	Avec cet argument, [le clou a été frappé sur la tête].	Avec cet argument, [la cause est entendue].
								
S17 a	Syn 1: Yes-no question syntax	Does the marked portion of the French translation constitutes a syntactically correct rendering of the corresponding part of the English source?	[Have the kids] ever watched that movie?	[Les enfants] jamais regardé ce film?	[Les enfants ont] jamais regardé ce film?	[Les enfants ont-ils] déjà regardé ce film?	[Les enfants ont-ils] déjà regardé ce film?	[Les enfants ont-ils] déjà vu ce film?
S17b			[Hasn't your boss denied you] a promotion? 	[N'a pas nié votre patron vous] un promotion?	[N'a pas nié votre patron vous] un promotion?	[Est-ce que votre patron vous a refusé] une promotion ?	[Votre patron ne vous a-t-il pas refusé] une promotion?	[Votre patron ne vous a-t-il pas refusé] une promotion?
S17c			[Shouldn't I attend] this meeting?	[Ne devrais-je pas assister] à cette réunion?	[Ne devrais-je pas assister] à cette réunion?	[Est-ce que je ne devrais pas assister] à cette réunion?	[Ne devrais-je pas assister] à cette réunion?	[Ne devrais-je pas assister] à cette réunion?
								
S18a	Syn 2: Tag questions	Is the "tag question" part of the English source correctly rendered in the French translation?	Mary looked really happy tonight, [didn't she]?	Marie a regardé vraiment heureux de ce soir, [n'est-ce pas elle] ?	Marie semblait très heureux ce soir, [n'a pas elle]?	Mary s'est montrée vraiment heureuse ce soir, [ne l' a pas fait] ?	Mary avait l'air vraiment heureuse ce soir, [n'est-ce pas]?	Mary avait l'air vraiment heureuse ce soir, [n'est-ce pas]?
S18b			We should not do that again, [should we]?	Nous ne devrions pas faire qu'une fois encore , [faut-il]?	Nous ne devrions pas le faire de nouveau, [faut-il]?	Nous ne devrions pas le faire encore , [si nous] ?	Nous ne devrions pas recommencer, [n'est-ce pas]?	Nous ne devrions pas refaire cela, [n'est-ce pas]?
